<?xml version="1.0" encoding="UTF-8"?>
<EmendaProposicao xmlns="http://www.lexml.gov.br/lexml-emenda-proposicao/1.0" xmlns:xsi="http://www.w3.org/2001/XMLSchema-instance"
  xsi:schemaLocation="http://www.lexml.gov.br/lexml-emenda-proposicao/1.0 ../xsd/lexml-emenda-proposicao.xsd">
  <MetadadoEmenda>
    <Propriedades>
      <Descricao></Descricao>
      <Elaborador>fragomeni</Elaborador>
      <Concluida>0</Concluida>
      <Observacao></Observacao>
      <Situacao>Emenda Inv√°lida</Situacao>
    </Propriedades>
  </MetadadoEmenda>
  <Emenda id='emd'>
    <Proposicao URN='urn:lex:br:congresso.nacional:medida.provisoria:2005-04-04;244:@200504040101'>MPV 244/2005</Proposicao>
    <Marcadores>
      <DispositivosImportados></DispositivosImportados>
      <DispositivosSuprimidos></DispositivosSuprimidos>
      <DispositivosModificados></DispositivosModificados>
      <DispositivosAdicionados>
        <Adicao id='adi1' parteProposicao='Texto' refidPai="art1_cpt">
          <Inciso id="art1_cpt_inc1">
            <Rotulo>I -</Rotulo>
            <p> kkkkkk </p>
          </Inciso>
        </Adicao>
      </DispositivosAdicionados>
    </Marcadores>
    <Justificativa id='emd1_jus'>
    </Justificativa>
    <ComandoEmenda id="emd_cmd1" tipoComando="simples" acaoComando="alteracao"></ComandoEmenda>
  </Emenda>
</EmendaProposicao>